{
  "$schema": "https://json-schema.org/draft/2020-12/schema",
  "$id": "https://schema.toolsenabled.local/schema/subscription-catalog.schema.json",
  "title": "Subscription plan catalog",
  "description": "What the subscription page at #/subscribe is allowed to say, and nothing else. public/data/subscription-catalog.json is GENERATED by tools/gen-subscription-catalog.mjs from the engine's own entitlement model (src/lib/entitlement.js) -- the page that takes money is not allowed to know its own prices, so there is no hand-written copy to drift. THE RENDERER OWNS THIS SCHEMA; the generator owns the content. tools/check-data-schemas.mjs validates one against the other on every build, and src/subscription-catalog.js re-validates in the browser and fails closed: a catalog this schema would reject renders as a refusal with signup disabled, never as a partial plan list. One cross-field rule lives in that reader rather than here, because this validator cannot express it: every id in a plan's `grants` must name an entry in `capabilities`.",
  "type": "object",
  "additionalProperties": false,
  "required": [
    "schemaVersion", "domain", "generatedAt", "derivedFrom",
    "paidProduct", "unlicensedInstall", "unlicensedInstallStatement",
    "neverGated", "capabilities", "plans"
  ],
  "properties": {
    "schemaVersion": { "const": 1 },
    "domain": { "const": "subscription-catalog" },
    "generatedAt": { "type": "string", "format": "date-time" },
    "derivedFrom": {
      "const": "src/lib/entitlement.js",
      "description": "The engine module every word of this file is derived from, named so a reader can check the derivation instead of trusting it."
    },
    "paidProduct": { "type": "string", "minLength": 1, "maxLength": 120 },
    "unlicensedInstall": { "type": "string", "minLength": 1, "maxLength": 120 },
    "unlicensedInstallStatement": {
      "type": "string",
      "minLength": 1,
      "maxLength": 1000,
      "description": "What an install without a licence is, in the model's own words. Rendered whole: a pricing page that shows only the paid column implies the free product is a trial, which R1228/R1229 refuse."
    },
    "neverGated": {
      "type": "array",
      "minItems": 1,
      "maxItems": 40,
      "items": { "type": "string", "minLength": 1, "maxLength": 300 },
      "description": "What is free forever and never licence-checked. Non-empty on purpose: the reader refuses a catalog that states what money buys and not what is free beside it."
    },
    "capabilities": {
      "type": "object",
      "additionalProperties": { "$ref": "#/$defs/capability" },
      "description": "The closed table of everything a licence may gate, keyed by capability id. Plans may only include ids described here -- an inclusion line the model cannot describe is an inclusion the page cannot promise."
    },
    "plans": {
      "type": "array",
      "minItems": 1,
      "maxItems": 12,
      "items": { "$ref": "#/$defs/plan" }
    }
  },
  "$defs": {
    "capability": {
      "type": "object",
      "additionalProperties": false,
      "required": ["id", "label", "rationale", "requiredTiers", "freeAlternatives"],
      "properties": {
        "id": { "type": "string", "pattern": "^[a-z0-9][a-z0-9-]{0,63}$" },
        "label": { "type": "string", "minLength": 1, "maxLength": 120 },
        "rationale": {
          "type": "string",
          "minLength": 1,
          "maxLength": 600,
          "description": "Why this costs money. A paid inclusion with no stated reason is a line item, not an explanation, and the page is not allowed to charge for one."
        },
        "requiredTiers": {
          "type": "array",
          "minItems": 1,
          "maxItems": 12,
          "items": { "type": "string", "minLength": 1, "maxLength": 64 },
          "description": "The plan ids this capability belongs to. The generator refuses a model where a tier grants a capability whose requiredTiers does not admit that tier -- a contradiction inside the model must not be published as a plan card."
        },
        "freeAlternatives": {
          "type": "array",
          "minItems": 1,
          "maxItems": 8,
          "items": { "type": "string", "minLength": 1, "maxLength": 300 },
          "description": "Non-empty on purpose (R1228): a gate that cannot name a free way to do the job is a hostage situation, so every gated capability states its alternatives and the page shows them."
        }
      }
    },
    "plan": {
      "type": "object",
      "additionalProperties": false,
      "required": [
        "id", "label", "qualifiedLabel", "requiresLicense",
        "monthlyUsd", "annualUsd", "seatMinimum", "productId", "grants"
      ],
      "properties": {
        "id": { "type": "string", "pattern": "^[a-z0-9][a-z0-9-]{0,63}$" },
        "label": { "type": "string", "minLength": 1, "maxLength": 80 },
        "qualifiedLabel": {
          "type": "string",
          "minLength": 1,
          "maxLength": 160,
          "description": "The label with the paid product's name in front of it, for surfaces where the bare label would read as gating the whole product."
        },
        "requiresLicense": { "type": "boolean" },
        "monthlyUsd": {
          "type": ["number", "null"],
          "minimum": 0,
          "maximum": 100000,
          "description": "Major units (dollars). null means the model prices this plan no way at all -- legal only for a free plan; the conditional below and the generator both refuse a paid plan without a real price, because a blank or guessed price on a subscription page is how a customer is charged something they were never shown."
        },
        "annualUsd": {
          "type": ["number", "null"],
          "minimum": 0,
          "maximum": 1000000,
          "description": "null means no annual price is offered. It does NOT mean unknown."
        },
        "seatMinimum": {
          "type": ["integer", "null"],
          "minimum": 1,
          "maximum": 10000,
          "description": "null means no seat minimum."
        },
        "productId": {
          "type": ["string", "null"],
          "minLength": 1,
          "maxLength": 120,
          "description": "What the licensing service issues a licence against. Required for a paid plan (see the conditional): a payment that maps back to no tier is money taken for an entitlement nothing can issue."
        },
        "grants": {
          "type": "array",
          "minItems": 0,
          "maxItems": 32,
          "items": { "type": "string", "minLength": 1, "maxLength": 64 },
          "description": "Capability ids from the top-level `capabilities` table. That containment is enforced by the generator and re-checked at load by src/subscription-catalog.js; this validator cannot see across fields."
        }
      },
      "allOf": [
        {
          "if": { "properties": { "requiresLicense": { "const": true } }, "required": ["requiresLicense"] },
          "then": {
            "properties": {
              "monthlyUsd": { "type": "number", "minimum": 0.01 },
              "productId": { "type": "string" }
            },
            "required": ["monthlyUsd", "productId"]
          }
        }
      ]
    }
  }
}
